{
  "format_version": "0.1-draft",
  "benchmark": {
    "id": "trace-adversarial",
    "version": "0.1.0-rc.1",
    "status": "candidate"
  },
  "suite": {
    "id": "promptsyntax-conformance",
    "version": "0.1.0-rc.1",
    "status": "candidate"
  },
  "profile": {
    "id": "trace-user-0-3-draft",
    "version": "0.1.0-rc.1",
    "status": "candidate"
  },
  "conformant": true,
  "summary": {
    "threat_classes": 5,
    "unique_controls": 10,
    "controls_accepted": 10,
    "mutations": 18,
    "controlled_mutations": 18,
    "exactly_detected": 18,
    "rejected_with_unexpected_diagnostics": 0,
    "escaped": 0,
    "invalid_controls": 0,
    "missing_mutations": 0
  },
  "rates": {
    "control_acceptance": {
      "numerator": 10,
      "denominator": 10
    },
    "exact_mutation_detection": {
      "numerator": 18,
      "denominator": 18
    }
  },
  "coverage": {
    "eligible_mutants": 18,
    "scored_mutants": 18,
    "missing": [],
    "extra": []
  },
  "controls": [
    {
      "case": "entity-authored-fallback-valid",
      "accepted": true,
      "actual_diagnostics": []
    },
    {
      "case": "entity-kept-strict-valid",
      "accepted": true,
      "actual_diagnostics": []
    },
    {
      "case": "entity-substituted-best-effort-valid",
      "accepted": true,
      "actual_diagnostics": []
    },
    {
      "case": "producer-boundary-outcome-match",
      "accepted": true,
      "actual_diagnostics": []
    },
    {
      "case": "producer-external-artifact-valid",
      "accepted": true,
      "actual_diagnostics": []
    },
    {
      "case": "producer-request-and-bound-match",
      "accepted": true,
      "actual_diagnostics": []
    },
    {
      "case": "r1-inline-segments-contiguous",
      "accepted": true,
      "actual_diagnostics": []
    },
    {
      "case": "r2-injected-segment-step-valid",
      "accepted": true,
      "actual_diagnostics": []
    },
    {
      "case": "r2-r3-injected-provenance-valid",
      "accepted": true,
      "actual_diagnostics": []
    },
    {
      "case": "r5-oversight-materialized-valid",
      "accepted": true,
      "actual_diagnostics": []
    }
  ],
  "threat_classes": [
    {
      "id": "assembly-provenance",
      "description": "Mutations that make ordered prompt assembly or provenance pointers incomplete, ambiguous, or cyclic.",
      "mutations": 4,
      "exactly_detected": 4,
      "rejected_with_unexpected_diagnostics": 0,
      "escaped": 0,
      "invalid_controls": 0,
      "missing_mutations": 0,
      "exact_detection_rate": {
        "numerator": 4,
        "denominator": 4
      }
    },
    {
      "id": "content-integrity",
      "description": "Mutations that make materialized content disagree with its declared availability, digest, or UTF-8 byte length.",
      "mutations": 3,
      "exactly_detected": 3,
      "rejected_with_unexpected_diagnostics": 0,
      "escaped": 0,
      "invalid_controls": 0,
      "missing_mutations": 0,
      "exact_detection_rate": {
        "numerator": 3,
        "denominator": 3
      }
    },
    {
      "id": "routing-resolution",
      "description": "Mutations that conceal or contradict the requested, applied, fallback, or resolved entity.",
      "mutations": 5,
      "exactly_detected": 5,
      "rejected_with_unexpected_diagnostics": 0,
      "escaped": 0,
      "invalid_controls": 0,
      "missing_mutations": 0,
      "exact_detection_rate": {
        "numerator": 5,
        "denominator": 5
      }
    },
    {
      "id": "event-boundary",
      "description": "Mutations that make turn events or tool-boundary outcomes ambiguous or inconsistent.",
      "mutations": 3,
      "exactly_detected": 3,
      "rejected_with_unexpected_diagnostics": 0,
      "escaped": 0,
      "invalid_controls": 0,
      "missing_mutations": 0,
      "exact_detection_rate": {
        "numerator": 3,
        "denominator": 3
      }
    },
    {
      "id": "independent-replay",
      "description": "Mutations exposed only by comparing the Trace with independently observed request, routing, or artifact facts.",
      "mutations": 3,
      "exactly_detected": 3,
      "rejected_with_unexpected_diagnostics": 0,
      "escaped": 0,
      "invalid_controls": 0,
      "missing_mutations": 0,
      "exact_detection_rate": {
        "numerator": 3,
        "denominator": 3
      }
    }
  ],
  "mutations": [
    {
      "id": "A001",
      "threat_class": "assembly-provenance",
      "operator": "field-replacement",
      "baseline_case": "r1-inline-segments-contiguous",
      "mutant_case": "r1-segment-index-gap",
      "controlled_change": true,
      "controlled_paths": [
        "/trace/events/0/segments/0/i"
      ],
      "observed_paths": [
        "/trace/events/0/segments/0/i"
      ],
      "status": "exact-detection",
      "intended_diagnostics": [
        "TRACE_R1_SEGMENT_INDEX_INVALID"
      ],
      "actual_diagnostics": [
        "TRACE_R1_SEGMENT_INDEX_INVALID"
      ]
    },
    {
      "id": "A002",
      "threat_class": "assembly-provenance",
      "operator": "field-replacement",
      "baseline_case": "r2-injected-segment-step-valid",
      "mutant_case": "r2-dangling-segment-step",
      "controlled_change": true,
      "controlled_paths": [
        "/trace/events/0/segments/0/step"
      ],
      "observed_paths": [
        "/trace/events/0/segments/0/step"
      ],
      "status": "exact-detection",
      "intended_diagnostics": [
        "TRACE_R2_STEP_NOT_FOUND"
      ],
      "actual_diagnostics": [
        "TRACE_R2_STEP_NOT_FOUND"
      ]
    },
    {
      "id": "A003",
      "threat_class": "assembly-provenance",
      "operator": "field-replacement",
      "baseline_case": "r2-r3-injected-provenance-valid",
      "mutant_case": "r3-provenance-cycle",
      "controlled_change": true,
      "controlled_paths": [
        "/trace/events/0/steps/0/parent"
      ],
      "observed_paths": [
        "/trace/events/0/steps/0/parent"
      ],
      "status": "exact-detection",
      "intended_diagnostics": [
        "TRACE_R3_STEP_CYCLE"
      ],
      "actual_diagnostics": [
        "TRACE_R3_STEP_CYCLE"
      ]
    },
    {
      "id": "A004",
      "threat_class": "assembly-provenance",
      "operator": "duplication",
      "baseline_case": "r1-inline-segments-contiguous",
      "mutant_case": "tamper-duplicate-segment-id",
      "controlled_change": true,
      "controlled_paths": [
        "/trace/events/0/segments/1"
      ],
      "observed_paths": [
        "/trace/events/0/segments/1"
      ],
      "status": "exact-detection",
      "intended_diagnostics": [
        "TRACE_SEGMENT_ID_DUPLICATE"
      ],
      "actual_diagnostics": [
        "TRACE_SEGMENT_ID_DUPLICATE"
      ]
    },
    {
      "id": "A005",
      "threat_class": "content-integrity",
      "operator": "field-omission",
      "baseline_case": "r5-oversight-materialized-valid",
      "mutant_case": "r5-oversight-materialization-missing",
      "controlled_change": true,
      "controlled_paths": [
        "/trace/events/0/segments/0/content/materialized"
      ],
      "observed_paths": [
        "/trace/events/0/segments/0/content/materialized"
      ],
      "status": "exact-detection",
      "intended_diagnostics": [
        "TRACE_R5_MATERIALIZATION_REQUIRED"
      ],
      "actual_diagnostics": [
        "TRACE_R5_MATERIALIZATION_REQUIRED"
      ]
    },
    {
      "id": "A006",
      "threat_class": "content-integrity",
      "operator": "content-corruption",
      "baseline_case": "r5-oversight-materialized-valid",
      "mutant_case": "tamper-external-digest-mismatch",
      "controlled_change": true,
      "controlled_paths": [
        "/trace/events/0/segments/0/content/materialized/text"
      ],
      "observed_paths": [
        "/trace/events/0/segments/0/content/materialized/text"
      ],
      "status": "exact-detection",
      "intended_diagnostics": [
        "TRACE_CONTENT_DIGEST_MISMATCH"
      ],
      "actual_diagnostics": [
        "TRACE_CONTENT_DIGEST_MISMATCH"
      ]
    },
    {
      "id": "A007",
      "threat_class": "content-integrity",
      "operator": "metadata-corruption",
      "baseline_case": "r5-oversight-materialized-valid",
      "mutant_case": "tamper-external-length-mismatch",
      "controlled_change": true,
      "controlled_paths": [
        "/trace/events/0/segments/0/content/length"
      ],
      "observed_paths": [
        "/trace/events/0/segments/0/content/length"
      ],
      "status": "exact-detection",
      "intended_diagnostics": [
        "TRACE_CONTENT_LENGTH_MISMATCH"
      ],
      "actual_diagnostics": [
        "TRACE_CONTENT_LENGTH_MISMATCH"
      ]
    },
    {
      "id": "A008",
      "threat_class": "routing-resolution",
      "operator": "field-replacement",
      "baseline_case": "entity-kept-strict-valid",
      "mutant_case": "entity-kept-applied-mismatch",
      "controlled_change": true,
      "controlled_paths": [
        "/trace/events/0/routing/fill/0/applied"
      ],
      "observed_paths": [
        "/trace/events/0/routing/fill/0/applied"
      ],
      "status": "exact-detection",
      "intended_diagnostics": [
        "TRACE_ENTITY_KEPT_MISMATCH",
        "TRACE_ROUTING_FILL_MISMATCH"
      ],
      "actual_diagnostics": [
        "TRACE_ENTITY_KEPT_MISMATCH",
        "TRACE_ROUTING_FILL_MISMATCH"
      ]
    },
    {
      "id": "A009",
      "threat_class": "routing-resolution",
      "operator": "policy-conflict",
      "baseline_case": "entity-substituted-best-effort-valid",
      "mutant_case": "entity-substituted-under-strict",
      "controlled_change": true,
      "controlled_paths": [
        "/trace/events/0/routing/attempts/0/ref",
        "/trace/events/0/routing/fill/0/policy",
        "/trace/events/0/routing/policy",
        "/trace/events/0/routing/requested"
      ],
      "observed_paths": [
        "/trace/events/0/routing/attempts/0/ref",
        "/trace/events/0/routing/fill/0/policy",